{
  "schemaVersion": "1",
  "tool": {
    "name": "airom",
    "version": "dev",
    "rulesVersion": "builtin",
    "rulesHash": "0000000000000000000000000000000000000000000000000000000000000000",
    "eolCatalog": "builtin"
  },
  "serial": "urn:uuid:00000000-0000-4000-8000-000000000000",
  "timestamp": "2026-09-29T12:00:00Z",
  "lifecycle": "pre-build",
  "source": {
    "kind": "dir",
    "target": "go-openai"
  },
  "root": "airom:f7e06de2ad26950f",
  "components": [
    {
      "id": "airom:d641d9eba24d3a58",
      "kind": "hosted-llm",
      "name": "gpt-4o",
      "confidence": 0.75,
      "evidence": {
        "occurrences": [
          {
            "location": {
              "path": "main.go",
              "line": 12
            },
            "detectorId": "gosrc/ast",
            "method": "ast-fingerprint",
            "confidence": 0.75,
            "snippet": "model := \"gpt-4o\"",
            "symbol": "main"
          }
        ]
      },
      "props": [
        {
          "name": "airom:model.id",
          "value": "gpt-4o"
        }
      ]
    },
    {
      "id": "airom:f7e06de2ad26950f",
      "kind": "application",
      "name": "go-openai",
      "confidence": 0,
      "evidence": {}
    },
    {
      "id": "airom:f96ee68bb40a8bb3",
      "kind": "library",
      "name": "github.com/sashabaranov/go-openai",
      "version": "v1.32.0",
      "provider": "openai",
      "purl": "pkg:golang/github.com/sashabaranov/go-openai@v1.32.0",
      "package": {
        "ecosystem": "golang"
      },
      "confidence": 0.99,
      "evidence": {
        "occurrences": [
          {
            "location": {
              "path": "go.mod",
              "line": 5
            },
            "detectorId": "manifest/gomod",
            "method": "manifest-analysis",
            "confidence": 0.95,
            "snippet": "require github.com/sashabaranov/go-openai v1.32.0"
          },
          {
            "location": {
              "path": "main.go",
              "line": 7
            },
            "detectorId": "gosrc/ast",
            "method": "ast-fingerprint",
            "confidence": 0.8,
            "snippet": "openai \"github.com/sashabaranov/go-openai\""
          }
        ],
        "identity": [
          {
            "field": "version",
            "value": "v1.32.0",
            "confidence": 0.95,
            "methods": [
              "manifest-analysis"
            ]
          }
        ]
      }
    }
  ],
  "stats": {
    "filesWalked": 2,
    "filesProcessed": 2,
    "filesFailed": 0,
    "dirsPruned": 1,
    "headerBytes": 547,
    "contentBytes": 547,
    "durationNs": 0,
    "selection": [
      "dataset/file: selected by \"default\"",
      "frozen/pyinstaller: selected by \"default\"",
      "gosrc/ast: selected by \"default\"",
      "infra/compose: selected by \"default\"",
      "infra/dockerfile: selected by \"default\"",
      "manifest/nuget: selected by \"default\"",
      "manifest/cargo: selected by \"default\"",
      "manifest/gomod: selected by \"default\"",
      "manifest/gradle: selected by \"default\"",
      "manifest/pypi-installed: selected by \"default\"",
      "manifest/maven: selected by \"default\"",
      "manifest/npm: selected by \"default\"",
      "manifest/npm-lock: selected by \"default\"",
      "manifest/pipfile-lock: selected by \"default\"",
      "manifest/pnpm-lock: selected by \"default\"",
      "manifest/pypi-lock: selected by \"default\"",
      "manifest/pypi-pyproject: selected by \"default\"",
      "manifest/pypi-requirements: selected by \"default\"",
      "manifest/yarn-lock: selected by \"default\"",
      "modelfile/gguf: selected by \"default\"",
      "modelfile/onnx: selected by \"default\"",
      "modelfile/safetensors: selected by \"default\"",
      "modelfilex/hdf5: selected by \"default\"",
      "modelfilex/savedmodel: selected by \"default\"",
      "modelfilex/tflite: selected by \"default\"",
      "modelfilex/tensorrt: selected by \"default\"",
      "modelfilex/torch: selected by \"default\"",
      "pgext/control: selected by \"default\"",
      "pgext/module: selected by \"default\"",
      "project/adapter: selected by \"default\"",
      "project/configbind: selected by \"default\"",
      "project/hfdir: selected by \"default\"",
      "project/raglink: selected by \"default\"",
      "prompt/file: selected by \"default\"",
      "ruleengine: selected by \"default\""
    ],
    "detectors": [
      {
        "id": "dataset/file",
        "invocations": 0,
        "findings": 0,
        "ns": 0
      },
      {
        "id": "frozen/pyinstaller",
        "invocations": 0,
        "findings": 0,
        "ns": 0
      },
      {
        "id": "gosrc/ast",
        "invocations": 1,
        "findings": 2,
        "ns": 0
      },
      {
        "id": "infra/compose",
        "invocations": 0,
        "findings": 0,
        "ns": 0
      },
      {
        "id": "infra/dockerfile",
        "invocations": 0,
        "findings": 0,
        "ns": 0
      },
      {
        "id": "manifest/cargo",
        "invocations": 0,
        "findings": 0,
        "ns": 0
      },
      {
        "id": "manifest/gomod",
        "invocations": 1,
        "findings": 1,
        "ns": 0
      },
      {
        "id": "manifest/gradle",
        "invocations": 0,
        "findings": 0,
        "ns": 0
      },
      {
        "id": "manifest/maven",
        "invocations": 0,
        "findings": 0,
        "ns": 0
      },
      {
        "id": "manifest/npm",
        "invocations": 0,
        "findings": 0,
        "ns": 0
      },
      {
        "id": "manifest/npm-lock",
        "invocations": 0,
        "findings": 0,
        "ns": 0
      },
      {
        "id": "manifest/nuget",
        "invocations": 0,
        "findings": 0,
        "ns": 0
      },
      {
        "id": "manifest/pipfile-lock",
        "invocations": 0,
        "findings": 0,
        "ns": 0
      },
      {
        "id": "manifest/pnpm-lock",
        "invocations": 0,
        "findings": 0,
        "ns": 0
      },
      {
        "id": "manifest/pypi-installed",
        "invocations": 0,
        "findings": 0,
        "ns": 0
      },
      {
        "id": "manifest/pypi-lock",
        "invocations": 0,
        "findings": 0,
        "ns": 0
      },
      {
        "id": "manifest/pypi-pyproject",
        "invocations": 0,
        "findings": 0,
        "ns": 0
      },
      {
        "id": "manifest/pypi-requirements",
        "invocations": 0,
        "findings": 0,
        "ns": 0
      },
      {
        "id": "manifest/yarn-lock",
        "invocations": 0,
        "findings": 0,
        "ns": 0
      },
      {
        "id": "modelfile/gguf",
        "invocations": 0,
        "findings": 0,
        "ns": 0
      },
      {
        "id": "modelfile/onnx",
        "invocations": 0,
        "findings": 0,
        "ns": 0
      },
      {
        "id": "modelfile/safetensors",
        "invocations": 0,
        "findings": 0,
        "ns": 0
      },
      {
        "id": "modelfilex/hdf5",
        "invocations": 0,
        "findings": 0,
        "ns": 0
      },
      {
        "id": "modelfilex/savedmodel",
        "invocations": 0,
        "findings": 0,
        "ns": 0
      },
      {
        "id": "modelfilex/tensorrt",
        "invocations": 0,
        "findings": 0,
        "ns": 0
      },
      {
        "id": "modelfilex/tflite",
        "invocations": 0,
        "findings": 0,
        "ns": 0
      },
      {
        "id": "modelfilex/torch",
        "invocations": 0,
        "findings": 0,
        "ns": 0
      },
      {
        "id": "pgext/control",
        "invocations": 0,
        "findings": 0,
        "ns": 0
      },
      {
        "id": "pgext/module",
        "invocations": 0,
        "findings": 0,
        "ns": 0
      },
      {
        "id": "project/adapter",
        "invocations": 1,
        "findings": 0,
        "ns": 0
      },
      {
        "id": "project/configbind",
        "invocations": 1,
        "findings": 0,
        "ns": 0
      },
      {
        "id": "project/hfdir",
        "invocations": 1,
        "findings": 0,
        "ns": 0
      },
      {
        "id": "project/raglink",
        "invocations": 1,
        "findings": 0,
        "ns": 0
      },
      {
        "id": "prompt/file",
        "invocations": 0,
        "findings": 0,
        "ns": 0
      },
      {
        "id": "ruleengine",
        "invocations": 1,
        "findings": 0,
        "ns": 0
      }
    ],
    "enrichment": {
      "cve": {
        "enabled": false
      },
      "eol": {
        "enabled": true,
        "catalogLoaded": true
      }
    },
    "confidenceModel": "evidence-weighted/1; not empirically calibrated"
  }
}
